 published_at , author ,source_name,title ,description
2022-01-10T16:30:00Z,Zacks Equity Research,Zacks.com,Apple (AAPL) to Reopen iPhone Manufacturing Factory in India,Apple's (AAPL) key manufacturing partner Foxconn will reopen the iPhone manufacturing facility in India after addressing the Labor Law Violation issues
2022-01-11T16:09:00Z,Zacks Equity Research,Zacks.com,Apple (AAPL) Reportedly Discussing Streaming Deal with MLB,Apple (AAPL) is reportedly discussing a deal with Major League Baseball to stream weekday national games via its Apple TV+ streaming service.
2022-01-25T18:09:00Z,Zacks Equity Research,Zacks.com,Apple (AAPL) to Report Q1 Earnings: What's in the Offing?,Apple's (AAPL) first-quarter fiscal 2022 earnings are expected to have benefited from strong sales of the 5G-enabled iPhone 13 despite supply-chain constraints.
2022-01-25T19:09:00Z,Zacks Equity Research,Zacks.com,Apple's (AAPL) Supply Chain Woes Persist Ahead of Q1 Results,"Apple (AAPL) is still facing supply chain constraints ahead of the release of Quarter 1 results for 2022, which is further complicated by Apple's launch of new products"
2022-01-26T17:57:00Z,Zacks Equity Research,Zacks.com,Can Continued Services Growth Aid Apple's (AAPL) Q1 Earnings?,Apple's (AAPL) first-quarter fiscal 2022 results are expected to reflect expanding Services business as well as solid Mac sales.
2022-01-03T21:41:00Z,noreply@blogger.com (Unknown),Blogspot.com,Apple has become the world's first $3 trillion company,"<table><tr><td></td></tr><tr><td>Apple CEO Tim Cook greets fans outside the Apple Store on Fifth Ave in the Manhattan borough of New York, New York, U.S., September 20, 2019. REUTERS/Carlo Allegri</td></tr>
</table>Apple has taken another important step. The…"
2022-01-14T17:40:00Z,Sheraz Mian,Zacks.com,"Q4 Earnings Update and Analyst Reports for Apple, JNJ & McDonald's","In addition to a real-time Q4 scorecard, today's article features new research reports Apple (AAPL), Johnson & Johnson (JNJ), McDonald's (MCD) and others."
2021-12-30T13:59:00Z,,Reuters,LIVE MARKETS The Apple of the Nasdaq 100's eye - Reuters,"Welcome to the home for real-time coverage of markets brought to you by Reuters reporters. You can share your thoughts with us at <a href=""mailto:markets.research@thomsonreuters.com"" target=""_blank"">markets.research@thomsonreuters.com</a>"
2022-01-04T16:35:09Z,Subhasree Kar,StockNews.com,Is Now a Good Time to Scoop Up Shares of Twitter Stock in Anticipation of a 2022 Rebound?,"Social networking service provider Twitter (TWTR) has struggled with Apple’s (AAPL) privacy changes over the past few months. The uncertainty concerning the iOS changes could be challenging for the company,..."
2021-12-30T14:59:00Z,,Reuters,LIVE MARKETS Dow Industrials shoots for seventh straight gain - Reuters,"Welcome to the home for real-time coverage of markets brought to you by Reuters reporters. You can share your thoughts with us at <a href=""mailto:markets.research@thomsonreuters.com"" target=""_blank"">markets.research@thomsonreuters.com</a>"
2021-12-28T13:22:15Z,Ben Lovejoy,9to5Mac,Record AAPL highs keep coming; could hit three trillion dollars today,"The record AAPL highs keep coming, with yesterday’s closing value of $180.33 the fifth time the stock has broken a new record this month alone.
AAPL Investors shows that the stock set new records on December 6, 7, 8, 10, and 27. This follows six records last …"
2022-01-25T15:31:05Z,Ben Lovejoy,9to5Mac,"AAPL stock still falling, but Wall Street expecting another record quarter","AAPL stock is still falling a couple of days ahead of the company’s earnings report, but Wall Street is expecting another record quarter.
AAPL has fallen from just under $183 earlier this month, when the company hit a $3 trillion market cap, to $158 today – f…"
2021-12-30T15:45:00Z,,Reuters,"LIVE MARKETS Jobless claims, Chicago PMI: The economy skips languidly toward 2021 finish line - Reuters","Welcome to the home for real-time coverage of markets brought to you by Reuters reporters. You can share your thoughts with us at <a href=""mailto:markets.research@thomsonreuters.com"" target=""_blank"">markets.research@thomsonreuters.com</a>"
2022-01-24T15:47:00Z,Zacks Equity Research,Zacks.com,Market Futures Lower Ahead of Opening,Market Futures Lower Ahead of Opening
2022-01-24T15:39:00Z,Mark Vickery,Zacks.com,More of the Same to Start a New Trading Week,"The sell-off continues, rolling back the market exuberance felt in the final months of 2021."
2021-12-30T10:17:00Z,Zacks Equity Research,Zacks.com,"The Zacks Analyst Blog Highlights: Apple, Abbott Laboratories, Infosys, General Motors and NIO","The Zacks Analyst Blog Highlights: Apple, Abbott Laboratories, Infosys, General Motors and NIO"
2021-12-30T18:10:00Z,,Reuters,LIVE MARKETS Small caps vs large caps in 2022: Drum roll please... - Reuters,"Welcome to the home for real-time coverage of markets brought to you by Reuters reporters. You can share your thoughts with us at <a href=""mailto:markets.research@thomsonreuters.com"" target=""_blank"">markets.research@thomsonreuters.com</a>"
2021-12-30T21:14:00Z,,Reuters,LIVE MARKETS Dow Industrials snaps six-day win streak - Reuters,"Welcome to the home for real-time coverage of markets brought to you by Reuters reporters. You can share your thoughts with us at <a href=""mailto:markets.research@thomsonreuters.com"" target=""_blank"">markets.research@thomsonreuters.com</a>"
2021-12-30T15:37:00Z,Zacks Equity Research,Zacks.com,Alphabet (GOOGL) Boosts Google TV Efforts With TVision Hub,"Alphabet's (GOOGL) Google TV gets a new dongle named TVision Hub from T-Mobile in a bid to provide an enhanced viewing experience to customers in the United States, per reports."
2022-01-18T18:48:00Z,Neena Mishra,Zacks.com,Why You Should Invest in Dividend Growth ETFs Now,We highlight 3 ultra-cheap ETFs that focus on high quality dividend payers
