 published_at , author ,source_name,title ,description
2022-01-04T16:40:11Z,Zacks Equity Research,Zacks.com,F vs. TSLA: Which Stock Should Value Investors Buy Now?,F vs. TSLA: Which Stock Is the Better Value Option?
2022-01-21T11:50:00Z,Nalak Das,Zacks.com,6 Must-Buy Large-Cap Stocks Ahead of Q4 Earnings Next Week,"Six large-cap companies will report earnings next week. These are: TSLA, URI, FCX, VRTX, STLD and BRO."
2022-01-20T15:51:00Z,Zacks Equity Research,Zacks.com,Why We Expect Tesla (TSLA) to Deliver Q4 Earnings Beat,Robust demand for Model 3/Y and stellar performance of the solar arm are likely to buoy Tesla's (TSLA) Q4 earnings.
2022-01-03T21:41:00Z,noreply@blogger.com (Unknown),Blogspot.com,Apple has become the world's first $3 trillion company,"<table><tr><td></td></tr><tr><td>Apple CEO Tim Cook greets fans outside the Apple Store on Fifth Ave in the Manhattan borough of New York, New York, U.S., September 20, 2019. REUTERS/Carlo Allegri</td></tr>
</table>Apple has taken another important step. The…"
2022-01-19T15:08:58Z,Oleksandr Pylypenko,StockNews.com,Tesla vs. Fisker: Which Electric Vehicle Stock is a Better Buy?,Today I'll analyze and compare Tesla (TSLA) and Fisker (FSR) to determine which electric vehicle (EV) stock is currently the better investment.
2022-01-02T19:30:00Z,noreply@blogger.com (Unknown),Blogspot.com,China to cut new energy vehicle subsidies by 30% in 2022,"<table><tr><td></td></tr><tr><td>Image Credit: REUTERS/Aly Song</td></tr>
</table>China will cut subsidies for New Energy Vehicles (NEVs) such as electric cars by 30% in 2022 and withdraw them all by the end of the year, the Treasury Department said on its w…"
2022-01-03T16:00:00Z,,Reuters,"BUZZ Tesla charged up after record deliveries, other EV stocks also rise - Reuters","** Shares of EV maker Tesla Inc <a href=""https://www.reuters.com/companies/TSLA.O"" target=""_blank"">(TSLA.O)</a> jump 9.35% to $1,155.55, set for best day since October"
2022-01-04T17:40:01Z,Priyanka Mandal,StockNews.com,The 5 Best Performing Pure Play Electric Vehicle Stocks of 2021,"The electric vehicle (EV) industry is expected to dominate the automotive industry over the next couple of decades, with increasing support from governments and consumers' growing uptake. Furthermore, rising crude..."
2021-12-28T23:20:50Z,Jaimini Desai,StockNews.com,Electric Vehicle Industry Report for 2022,"Sales of electric vehicles (EVs) have been skyrocketing and forecasts predict that sales will exponentially grow over the next decade. As a result, EV stocks, such as NIO (NIO) and..."
2022-01-24T15:47:00Z,Zacks Equity Research,Zacks.com,Market Futures Lower Ahead of Opening,Market Futures Lower Ahead of Opening
2022-01-24T15:39:00Z,Mark Vickery,Zacks.com,More of the Same to Start a New Trading Week,"The sell-off continues, rolling back the market exuberance felt in the final months of 2021."
2022-01-03T17:15:00Z,Sweta Killa,Zacks.com,ETFs to Drive Tesla's Near $1 Million Vehicle Deliveries,"Annual deliveries surged 87% year over year to 936,172 vehicles, marking the fastest pace of growth in many years."
2022-01-11T13:56:00Z,Investor's Business Daily,Investor's Business Daily,"Tesla Stock Rises As China Sales Topped 70,000 In December - Investor's Business Daily","<ol><li>Tesla Stock Rises As China Sales Topped 70,000 In December  Investor's Business Daily
</li><li>Tesla sold a record 70847 China-made vehicles in December  The Globe and Mail
</li><li>Tesla posts record numbers in China by selling 70,602 vehicles loca…"
2022-01-24T16:44:00Z,Zacks Equity Research,Zacks.com,"The Zacks Analyst Blog Highlights: Tesla Inc., Steel Dynamics Inc., United Rentals Inc., Freeport-McMoRan Inc. and Vertex Pharmaceuticals Inc.","Tesla Inc., Steel Dynamics Inc., United Rentals Inc., Freeport-McMoRan Inc. and Vertex Pharmaceuticals Inc. are included in this blog."
2022-01-19T12:45:00Z,Zacks Equity Research,Zacks.com,Ford (F) & ADT to Bolster Car Security With Canopy Venture,Ford (F) to join forces with ADT to form a new venture called Canopy that will strengthen vehicle security.
2021-12-29T19:30:00Z,Sanghamitra Saha,Zacks.com,Is ARK's Stellar Run Over? 5 ETF Themes to Follow Cathie Wood,"Though Cathie Wood's Ark Investment???s star products underperformed in 2021 and may continue to lag the broader market in 2022, Wood's fans may follow these ETF strategies to capitalize on..."
2022-01-06T11:20:12Z,Zacks Equity Research,Zacks.com,Should First Trust NASDAQ100 Equal Weighted ETF (QQEW) Be on Your Investing Radar?,Style Box ETF report for QQEW
2021-12-31T11:20:10Z,Zacks Equity Research,Zacks.com,Should Invesco Dynamic Large Cap Growth ETF (PWB) Be on Your Investing Radar?,Style Box ETF report for PWB
2022-01-20T11:20:10Z,Zacks Equity Research,Zacks.com,Is SPDR NYSE Technology ETF (XNTK) a Strong ETF Right Now?,Smart Beta ETF report for XNTK
2022-01-19T11:20:10Z,Zacks Equity Research,Zacks.com,Is Invesco S&P 500 Equal Weight ETF (RSP) a Strong ETF Right Now?,Smart Beta ETF report for RSP
